{
  "schema_version": "deep3d.flange/1",
  "units": "mm",
  "coordinate_system": "right_handed_z_up",
  "outer_diameter_mm": 100.0,
  "thickness_mm": 12.0,
  "center_hole_diameter_mm": 30.0,
  "bolt_hole_diameter_mm": 8.0,
  "bolt_circle_diameter_mm": 70.0,
  "hole_count": 4,
  "start_angle_rad": 0.0
}
